{
  "$schema": "https://json-schema.org/draft/2020-12/schema",
  "$id": "https://markup-carve.dev/schemas/include-conformance-vector.json",
  "title": "Carve include-conformance vector",
  "description": "One golden vector for the cross-engine file-inclusion conformance suite (PART 9 §19). Input fields describe the in-memory or on-disk fixture and the resolver/runtime options; `expected` holds the four golden outputs produced by the reference engine.",
  "type": "object",
  "required": ["name", "rules", "mode", "resolver", "expected"],
  "additionalProperties": false,
  "properties": {
    "name": {
      "type": "string",
      "description": "Unique vector id; also the file basename.",
      "pattern": "^[a-z0-9-]+$"
    },
    "description": {
      "type": "string",
      "description": "One-line human summary of what the vector pins."
    },
    "rules": {
      "type": "array",
      "description": "The §19 rule ids this vector exercises (I1..I15, plus I1a, I1b and I9a and the pseudo-rules 'multi-directive', 'quoted-path' and 'heading-include').",
      "minItems": 1,
      "items": {
        "type": "string",
        "pattern": "^(I(1[0-5]|[1-9])[ab]?|multi-directive|quoted-path|heading-include)$"
      }
    },
    "mode": {
      "type": "string",
      "description": "'virtual' serves an in-memory files map; 'filesystem' materializes a real tree under a tmp dir and uses the fileSystemResolver.",
      "enum": ["virtual", "filesystem"]
    },
    "resolver": {
      "type": "string",
      "description": "'none' configures no resolver (I3 literal case); 'virtual' serves the files map; 'filesystem' uses the fileSystemResolver over the materialized tree.",
      "enum": ["none", "virtual", "filesystem"]
    },
    "entry": {
      "type": "string",
      "description": "virtual mode: the top-level document source."
    },
    "files": {
      "type": "object",
      "description": "virtual mode: the in-memory filesystem, mapping a path (as written in a directive) to its Carve/text source.",
      "additionalProperties": { "type": "string" }
    },
    "tree": {
      "type": "object",
      "description": "filesystem mode: files and symlinks to materialize under a fresh tmp base. A string value is file content; a {symlink} object is a symbolic link whose target is resolved relative to the tree base.",
      "additionalProperties": {
        "oneOf": [
          { "type": "string" },
          {
            "type": "object",
            "required": ["symlink"],
            "additionalProperties": false,
            "properties": { "symlink": { "type": "string" } }
          }
        ]
      }
    },
    "entryPath": {
      "type": "string",
      "description": "filesystem mode: which tree file is the top-level document."
    },
    "root": {
      "type": "string",
      "description": "filesystem mode: the containment root, relative to the tree base ('.' means the base itself)."
    },
    "options": {
      "type": "object",
      "description": "Resolver / runtime options.",
      "additionalProperties": false,
      "properties": {
        "sourcePath": {
          "type": "string",
          "description": "Identity of the top-level document for warning attribution (I4). In filesystem mode, defaults to the real entry path; '<ENTRY>' requests that explicit default."
        },
        "maxDepth": { "type": "integer", "description": "Include-depth limit override (I6)." },
        "maxBytes": { "type": "integer", "description": "Expanded byte-budget override (I6)." },
        "allowAbsolute": {
          "type": "boolean",
          "description": "filesystem mode: allow absolute include paths after containment checks."
        },
        "resolverIds": {
          "type": "boolean",
          "description": "virtual mode: the resolver strips a leading './' and returns a canonical id, so two spellings of one file collapse (I6/I11 identity)."
        },
        "resolverThrows": {
          "type": "string",
          "description": "virtual mode: the resolver throws this message, exercising the I7 path where the raw error must stay out of the normalized warning."
        }
      }
    },
    "forbiddenSubstrings": {
      "type": "array",
      "description": "Substrings that MUST NOT appear in any warning message (I7 no-leak). Checked against raw messages by the runner.",
      "items": { "type": "string" }
    },
    "checkFmtExpandEquivalence": {
      "type": "boolean",
      "description": "When true, the runner also asserts that expanding the FORMATTED entry yields the same html + dependency set as expanding the original (I12 stronger invariant)."
    },
    "checkCarveTarget": {
      "type": "boolean",
      "description": "When true, the vector also carries expected.carveTarget (I15): the Carve source the processor produces with the resolver configured. An engine answers it through whatever path it uses for a Carve-target render."
    },
    "checkFlattened": {
      "type": "boolean",
      "description": "When true, the vector also carries expected.flattened: the Carve source of the expanded document."
    },
    "checkWarningLocations": {
      "type": "boolean",
      "description": "When true, assert each warning's source file and 1-based line in expected.warningLocations."
    },
    "expected": {
      "type": "object",
      "description": "The four golden outputs, produced by the reference engine and regenerated by scripts/gen-include-conformance.mjs.",
      "required": ["html", "fmt", "warnings", "dependencies"],
      "additionalProperties": false,
      "properties": {
        "html": {
          "type": "string",
          "description": "Expanded-then-rendered HTML."
        },
        "fmt": {
          "type": "string",
          "description": "The Carve serializer output of the PRE-EXPANSION document (pins I12 -- the directive survives formatting)."
        },
        "flattened": {
          "type": "string",
          "description": "Optional. The Carve source of the EXPANDED document - what `carve flatten` writes. Pins the shape of the assembled tree, which the html golden cannot: footnote definitions are collected globally either way, so a merged definition left interleaved between the parent's blocks renders identically and only shows up here."
        },
        "carveTarget": {
          "type": "string",
          "description": "Optional (I15). The Carve source a processor produces for this entry WITH THE RESOLVER CONFIGURED, through whatever path it uses for a Carve-target render. It must equal `fmt`: the Carve target does not expand. `fmt` cannot pin this on its own, because `fmt` is computed from the pre-expansion document by construction, so an engine that expands before writing satisfies it and still returns a different document."
        },
        "warnings": {
          "type": "array",
          "description": "Normalized warnings in document order. Each is { rule, file? }; message/detail/positions are excluded here. A vector can separately opt into warningLocations (see README normalization).",
          "items": {
            "type": "object",
            "required": ["rule"],
            "additionalProperties": false,
            "properties": {
              "rule": { "type": "string" },
              "file": { "type": "string" }
            }
          }
        },
        "warningLocations": {
          "type": "array",
          "description": "Optional fixture-specific source-site check outside the portable §19 warning contract, for vectors that set checkWarningLocations.",
          "items": {
            "type": "object",
            "required": ["rule", "line"],
            "additionalProperties": false,
            "properties": {
              "rule": { "type": "string" },
              "file": { "type": "string" },
              "line": { "type": "integer", "minimum": 1 }
            }
          }
        },
        "dependencies": {
          "type": "array",
          "description": "Normalized dependency set in first-encounter order (I11 contract). Each is { id, resolved }.",
          "items": {
            "type": "object",
            "required": ["id", "resolved"],
            "additionalProperties": false,
            "properties": {
              "id": { "type": "string" },
              "resolved": { "type": "boolean" }
            }
          }
        }
      }
    }
  }
}
